{
  "$schema": "http://json-schema.org/draft-07/schema#",
  "title": "Capability Manifest",
  "description": "Every capability in the registry must conform to this schema.",
  "type": "object",
  "required": [
    "tool",
    "description",
    "permission_level",
    "estimated_cost",
    "requires_network",
    "supports_rollback"
  ],
  "properties": {
    "tool": {
      "type": "string",
      "description": "Unique dot-namespaced identifier, e.g. 'app.open', 'git.commit'"
    },
    "description": {
      "type": "string",
      "description": "Human-readable description shown in consent dialogs and logs."
    },
    "permission_level": {
      "type": "integer",
      "minimum": 0,
      "maximum": 5,
      "description": "0=read-only, 1=interface, 2=file-write, 3=state-mutation, 4=destructive, 5=financial/identity"
    },
    "estimated_cost": {
      "type": "number",
      "minimum": 0.0,
      "maximum": 1.0,
      "description": "Normalized resource cost estimate [0, 1] for the Resource Governor."
    },
    "requires_network": {
      "type": "boolean"
    },
    "supports_rollback": {
      "type": "boolean",
      "description": "If false and permission_level >= 3, the action needs explicit human confirmation (see gatekeeper.needs_consent)."
    },
    "rollback_action": {
      "type": "string",
      "description": "Tool name to call to undo this action. Required when supports_rollback=true."
    },
    "params_schema": {
      "type": "object",
      "description": "JSON Schema fragment for accepted params. Used by the Action Validation Layer."
    },
    "rollback_params": {
      "type": "object",
      "description": "Params for rollback_action. String values '$params.<path>' / '$result.<path>' are filled from the original call's params or result."
    },
    "read_only": {
      "type": "boolean",
      "description": "True if the action changes nothing, so a transaction can skip it during rollback."
    },
    "patterns": {
      "type": "array",
      "description": "Typed phrases (Tier 1). Named regex groups become params; lower priority numbers are tried first (core uses 10-370, step 10).",
      "items": {
        "type": "object",
        "required": [
          "regex"
        ],
        "properties": {
          "regex": {
            "type": "string"
          },
          "priority": {
            "type": "integer"
          },
          "params": {
            "type": "object",
            "description": "Fixed params added when this phrase matches"
          }
        }
      }
    }
  }
}
